{
  "id": "biz_ecommerce",
  "object_type": "Business",
  "schema_version": "1.0.0",
  "business_id": "ecommerce",
  "created_at": "2026-08-18T00:00:00Z",
  "updated_at": "2026-08-18T00:00:00Z",
  "lineage": [],
  "name": "Field & Hearth",
  "business_models": [
    "Ecommerce"
  ],
  "industries": [
    "home goods"
  ]
}
