{
  "id": "biz_professional-service",
  "object_type": "Business",
  "schema_version": "1.0.0",
  "business_id": "professional-service",
  "created_at": "2026-08-18T00:00:00Z",
  "updated_at": "2026-08-18T00:00:00Z",
  "lineage": [],
  "name": "Apex Advisory",
  "business_models": [
    "Professional service"
  ],
  "industries": [
    "management consulting"
  ]
}
